[{"name":"Red dead redemption 2","žanr":"Vestern","publisher":"Rockstar games","voice_chat":"yes","review":"very positive","pg_rating":0,"price":60,"singleplayer_multiplayer_or_both":"both","time_to_complete":49,"Voice_Actors":[{"name":"Roger","surname":"Clark"}]},{"name":"Star Wars Battlefron 2","žanr":"Shooter","publisher":"Electronic Arts","voice_chat":"yes","review":"very positive","pg_rating":16,"price":40,"singleplayer_multiplayer_or_both":"both","time_to_complete":57,"Voice_Actors":[{"name":"Benjamin Byron","surname":"Davis"}]},{"name":"League of Legends","žanr":"MOBA","publisher":"Riot Games","voice_chat":"yes","review":"positive","pg_rating":10,"price":0,"singleplayer_multiplayer_or_both":"both","time_to_complete":0,"Voice_Actors":[{"name":"Janina","surname":"Gavankar"}]},{"name":"Dead by Daylight","žanr":"Action","publisher":"Behaviour Interactive Inc.","voice_chat":"no","review":"very positive","pg_rating":18,"price":0,"singleplayer_multiplayer_or_both":"multiplayer","time_to_complete":0,"Voice_Actors":[{"name":"Matthew","surname":"mercer"}]},{"name":"Grand Theft Auto 5","žanr":"Action","publisher":"Rockstar Games","voice_chat":"no","review":"very positive","pg_rating":18,"price":24,"singleplayer_multiplayer_or_both":"both","time_to_complete":31,"Voice_Actors":[{"name":"JB","surname":"Blanc"}]},{"name":"Transistor","žanr":"Action","publisher":"Supergiant Games","voice_chat":"no","review":"very positive","pg_rating":12,"price":17,"singleplayer_multiplayer_or_both":"singleplayer","time_to_complete":15,"Voice_Actors":[{"name":"Melissa","surname":"Hutchison"}]},{"name":"Hades","žanr":"RPG","publisher":"Supergiant Games","voice_chat":"no","review":"overwhelmingly positive","pg_rating":0,"price":21,"singleplayer_multiplayer_or_both":"singleplayer","time_to_complete":23,"Voice_Actors":[{"name":"Dylan","surname":"Kushner"}]},{"name":"Dota 2","žanr":"MOBA","publisher":"Valve","voice_chat":"no","review":"mostly positive","pg_rating":0,"price":0,"singleplayer_multiplayer_or_both":"multiplayer","time_to_complete":0,"Voice_Actors":[{"name":"Emelina ","surname":" Mårtensson"}]},{"name":"The Legend of Zelda: Breath of the Wild","žanr":"Action-adventure","publisher":"Nitendo","voice_chat":"no","review":"very positive","pg_rating":10,"price":60,"singleplayer_multiplayer_or_both":"singleplayer","time_to_complete":50,"Voice_Actors":[{"name":"Ned","surname":"Luke"}]},{"name":"World of Tanks","žanr":"Vehicular combat","publisher":"Wargaming","voice_chat":"yes","review":"very positive","pg_rating":7,"price":0,"singleplayer_multiplayer_or_both":"multiplayer","time_to_complete":0,"Voice_Actors":[{"name":"Shawn","surname":"Fonteno"}]}]
